{
  "contractVersion": "croccante.recording-session/v1",
  "sessionId": "22222222-2222-4222-8222-222222222222",
  "configurationHash": "1111111111111111111111111111111111111111111111111111111111111111",
  "state": "complete",
  "openedAt": "2026-09-07T01:00:00Z",
  "closedAt": "2026-09-07T01:00:00.700Z",
  "transitions": [
    {"sequence": 1, "state": "pending", "at": "2026-09-07T01:00:00Z", "reasonCode": null},
    {"sequence": 2, "state": "recording", "at": "2026-09-07T01:00:00.100Z", "reasonCode": null},
    {"sequence": 3, "state": "interrupted", "at": "2026-09-07T01:00:00.200Z", "reasonCode": "process_crashed"},
    {"sequence": 4, "state": "recovering", "at": "2026-09-07T01:00:00.250Z", "reasonCode": "process_crashed"},
    {"sequence": 5, "state": "recording", "at": "2026-09-07T01:00:00.300Z", "reasonCode": null},
    {"sequence": 6, "state": "finalizing", "at": "2026-09-07T01:00:00.600Z", "reasonCode": null},
    {"sequence": 7, "state": "complete", "at": "2026-09-07T01:00:00.700Z", "reasonCode": null}
  ],
  "capture": {
    "profile": {"container": "wav", "video": null, "audio": {"codec": "pcm_s16le", "sampleRateHz": 8000, "channels": 1}, "timeBase": "milliseconds"},
    "elapsedDurationMs": 400,
    "capturedDurationMs": 200,
    "droppedFrames": 2,
    "sourceTimeline": [
      {"sequence": 1, "startedOffsetMs": 0, "mode": "live"},
      {"sequence": 2, "startedOffsetMs": 100, "mode": "unobserved"},
      {"sequence": 3, "startedOffsetMs": 300, "mode": "live"}
    ],
    "segments": [
      {"kind": "segment", "sequence": 1, "storageKey": "artifacts/segment-000001.wav", "startedOffsetMs": 0, "durationMs": 100, "byteLength": 1644, "sha256": "dbf4734838892d8ac9e35fb8203e39c27e4db3f8c1403d811010ce0a68b18b2f"},
      {"kind": "segment", "sequence": 2, "storageKey": "artifacts/segment-000002.wav", "startedOffsetMs": 300, "durationMs": 100, "byteLength": 1644, "sha256": "a37b6d61cc013cee1ff933eb18e93594408af3bf16172226ed35ee284c927b65"}
    ],
    "finalArtifact": {"kind": "final", "storageKey": "artifacts/final.wav", "durationMs": 400, "byteLength": 6444, "sha256": "1251c1c245744338535341d7b96d670ae3afc3b90653e493fcd51892f5be36fd"}
  },
  "destinations": [
    {"slot": 1, "finalStatus": "accepted", "attempts": [
      {"sequence": 1, "startedAt": "2026-09-07T01:00:00.100Z", "endedAt": "2026-09-07T01:00:00.200Z", "status": "unknown", "observedBytes": 500, "errorCode": "process_crashed"},
      {"sequence": 2, "startedAt": "2026-09-07T01:00:00.300Z", "endedAt": "2026-09-07T01:00:00.650Z", "status": "accepted", "observedBytes": 3000, "errorCode": null}
    ]}
  ],
  "errors": [
    {"sequence": 1, "at": "2026-09-07T01:00:00.200Z", "phase": "recovery", "code": "process_crashed", "retryable": true}
  ],
  "retention": {"classification": "public-broadcast", "deleteAfter": "2026-10-07T01:00:00Z", "legalHold": false}
}
